<!ELEMENT Libro (Titulo,Seccion,Contenido,Copyright)>
<!ATTLIST Libro Catalogo NMTOKEN #REQUIRED>
<!ELEMENT Titulo (#PCDATA)>
<!ELEMENT Seccion (#PCDATA)>
<!ELEMENT Contenido (Capitulo,Separacion)>
<!ELEMENT Capitulo (Tema)>
<!ATTLIST Capitulo materia NMTOKEN #REQUIRED>
<!ELEMENT Tema (#PCDATA)>
<!ELEMENT Separacion EMPTY>
<!ELEMENT Copyright (#PCDATA)>